,question,answer
0,general ledger account,general ledger account account record used sort store summarize company transaction
1,difference general ledger control account,general ledger account become summary record referred control account
2,common example general ledger account become control,common example general ledger account become control account account receivable
3,calculate sale tax included company receipt,calculate sale tax included company receipt first calculate amount sale revenue company earned
4,difference sale tax sale revenue,illustrate let sale revenue let 0
5,accounting entry record information,general journal form accounting entry record information debit cashcredit sale sale revenuecredit sale tax payable 2100
6,account payable,account payable involves amount owed company supplier good service company received credit
7,current asset account,account receivable current asset account company record amount right collect customer received good service credit
8,difference credit sale debit sale,company record amount sale credit sale debit account receivable
9,term accrual expense mean,accrual expense usually involve accrual adjusting entry increase company expense increase current liability
10,example accrual expense liability,one example accrual expense liability major repair occurs final month accounting year paid bill received first month following year
11,happens utility us natural gas andor coal plus many employee generate electricity,instance december utility likely us natural gas andor coal plus many employee generate electricity used customer december
12,debtor,debtor person company entity owes money
13,creditor,creditor could bank supplier person provided money good service company expects paid later date
14,difference manufacturer retailer,manufacturer sell merchandise retailer term netdays manufacturer creditor retailer debtor
15,largest expense reported income statement,cost good sold likely largest expense reported income statement
16,cost good sold year,using dollar amount let assume retailer cost merchandise purchase year waswhile cost inventory increased fromto 120000
17,common cost flow assumption,common cost flow assumption include fifo lifo average
18,definition source business asset,owner equity also viewed source business asset
19,fair market value business,due cost principle amount owner equity considered fair market value business
20,petty cash,amount petty cash fund recorded current asset account entitled petty cash petty cash fund established
21,prepaid expense,generally amount prepaid expense used within one year reported company balance sheet current asset
22,amount paid advance insurance coverage company vehicle,amount paid often recorded current asset account prepaid insurance
23,accrued expense,accrued expense expense occurred yet recorded company general ledger
24,agreement three month december february,agreement requires company repay theon februaryalong withof interest three month december february
25,interest expense company incurred december,without adjusting entry accrue interest expense incurred company december company financial statement decemberwill reporting theof interest company incurred december
26,control account,control account keep general ledger free detail still correct balance preparing company financial statement
27,amount specific customer still owes,hence want find amount specific customer still owes purchase credit shown control account
28,general ledger,general ledger contains account used company sort store amount company transaction
29,general journal,entry general journal include date account amount debited account amount credited brief description
30,bank debit memo,bank debit memo item company bank account statement reduces company checking account balance
31,difference cost sale cost good sold,cost sale often line shown manufacturer retailer income statement instead cost good sold
32,financial statement focus user,many user financial statement must comply generally accepted accounting principle known gaap u gaap
33,topic distributed outside company,topic involve analysis report distributed outside company used management decision making planning control business operation
34,risk cash equivalent,word little risk collecting full amount reported
35,depreciation,depreciation defined systematic expensing cost asset equipment building vehicle etc
36,florist net income,recent year florist cash revenue ofcash expense ofand depreciation expense 8000
37,amount depreciation expense appropriate period time indicated,depreciation reported income statement amount depreciation expense appropriate period time indicated heading income statement
38,much depreciation reported balance sheet aftermonths use,aftermonths use accumulated depreciation reported balance sheet 24000
39,contra asset account,debit balance contra asset account violate cost principle
40,common account contra asset,account appears next current asset account receivable
41,difference debit credit,debit credit part accounting double entry system
42,common way use word charge,sometimes word charge used place debit
43,possible prove account balance correct,reconciling account likely mean proving documenting account balance correct
44,best way reconcile company bank statement,company reconciles bank statement reconciling balance general ledger account cash bank information
45,could meaning number,parenthesis around number could variety meaning
46,difference dividend share common stock,stock pay dividend distribution corporation profit owner
47,difference bond longterm debt,interest expense reduces corporation earnings taxable income
48,exception cost principle,exception change market value shortterm investment capital stock corporation whose share stock actively traded major stock exchange
49,cost principle,cost principle prohibits company recording asset acquired transaction
50,trial balance,trial balance list account general ledger balance
51,balance sheet,balance sheet prepared order report organization financial position end accounting period midnight december 31
52,company entry record loan payment,let assume company loan payment ofconsisting interest payment ofand principal payment 1500
53,nominal account,since balance carry forward next accounting year nominal account also referred temporary account
54,nominal account,nominal account almost always income statement account account recording revenue expense gain loss
55,account,accounting account record general ledger used sort store transaction
56,purpose statement cash flow,cash flow statement one required financial statement issued u
57,purpose cash flow statement,addition cash amount arranged three type activity cash flow statement discloses amount interest paid amount income tax paid significant investing financing activity require use cash
58,title general ledger liability account,title general ledger liability account may title unearned revenue deferred revenue customer deposit
59,much company able charge account design revenue,therefore record adjusting entry dated januarythat debit deferred revenue forand credit income statement account design revenue 20000
60,expense,expense cost company incurs us earns revenue
61,expenditure,expenditure may purchase asset reduction liability distribution owner could payment accounting period amount becomes expense
62,difference expense expenditure,example illustrate difference expense expenditure
63,basic accounting equation statement financial position,statement financial position must reflect basic accounting principle guideline cost matching full disclosure principle name
64,difference secured unsecured creditor,creditor referred secured creditor registered lien company asset
65,gross margin,gross margin amount remaining retailer manufacturer subtracts cost good sold net sale
66,difference two,let use sp indicate product required selling price mu represent gross profit state gross margin 0
67,common type asset likely listed company,example asset likely listed company balance sheet include cash temporary investment account receivable inventory prepaid expense longterm investment land building machine equipment furniture fixture vehicle goodwill
68,connection balance sheet income statement,illustrate connection balance sheet income statement let assume company owner equity wasat beginning year wasat end year
69,difference income statement account balance sheet account,balance sheet account also referred permanent real account end accounting year balance account closed
70,example corporation balance sheet account,example corporation balance sheet account include cash temporary investment account receivable allowance doubtful account inventory investment land building equipment furniture fixture accumulated depreciation note payable account payable payroll tax payable paidin capital retained earnings others
71,cost principle gaap,mean inventory cost good sold resulting net income must reflect manufacturer actual historical cost
72,common rule must followed financial statement distributed business,financial statement distributed business organization common rule must followed known generally accepted accounting principle gaap
73,noncurrent asset,noncurrent asset asset expected turn cash within one year date shown company balance sheet
74,best way get financial statement,reviewing financial statement accountant able make additional adjustment almost immediately obtain revised report
75,difference outstanding check deposit transit,outstanding check deduction balance per bank deposit transit addition balance per bank
76,term liability accounting bookkeeping,accounting bookkeeping term liability refers company obligation arising past transaction
77,term debt mean,others use term debt mean formal written loan bond payable
78,definition debt,example debt meaning total amount company liability look debttoequity ratio
79,definition property plant equipment,property plant equipment longterm asset noncurrent asset section balance sheet report tangible longlived asset used company operation
80,subtraction accumulated depreciation pertains,also included balance sheet classification subtraction accumulated depreciation pertains asset
81,definition operating expense,operating expense cost used part company main operating activity period shown heading income statement
82,main operating activity retailer,example retailer main operating activity involve buying selling merchandise good
83,definition revenue,revenue amount company receives selling good andor providing service customer client
84,much company gain sell truck,example company receivesfor old delivery truck truck carry amount time sale wasthe company gain 2400
85,definition income,generally accountant use term revenue gross amount received irs may use term income mean gross amount received
86,difference contra inventory account valuation account,often balance current asset account inventory reduced credit contra inventory account referred valuation account
87,effect writedown inventory balance sheet,since amount writedown inventory reduces net income also reduce amount reported balance sheet owner equity stockholder equity
88,difference company bank,company borrowsfrom bank company debtor bank creditor
89,net sale good,net sale cost good sold gross profit
90,gross profit ratio,gross profit ratio gross profit percentage 35
91,term net profit mean income tax expense,business regular corporation net profit may mean income tax expense
92,term cost mean,however use term cost mean amount spent purchase item service etc
93,much income statement report supply hand,result balance sheet report supply hand cost income statement report supply expense 7500
94,process preparing detailed projection future amount,budgeting process preparing detailed projection future amount
95,definition capital budgeting,capital budgeting involves future project overlap several many future accounting period
96,income statement,income statement account one two type general ledger account
97,common income statement account used business,many income statement account used business include sale sale return allowance service revenue cost good sold salary expense wage expense fringe benefit expense rent expense utility expense advertising expense automobile expense depreciation expense interest expense gain disposal truck many
98,difference amount revenue amount net income,revenue top line company income statement net income often referred bottom line
99,best way calculate company revenue accounting period,best way calculate company revenue accounting period year month etc
100,best way use word income referring amount earned customer,however best use word sale revenue referring amount earned customer use word income amount reflects subtraction expense
101,operating cycle,operating cycle time required company cash put operation return company cash account
102,full disclosure principle,full disclosure principle requires company provide necessary information people accustomed reading financial information able make informed decision regarding company
103,equipment placed service company begin report depreciation expense,equipment placed service company begin report depreciation expense profit loss statement year equipment used
104,much depreciation expense reported year,using straightline method depreciation year profit loss statement report depreciation expense offoryears
105,account temporary,account owner drawing account income summary account also temporary account
106,cost,cost might expense might asset
107,much property insurance bill next six month,company property insurance bill next six month insurance show cost 6000
108,amount insurance expires,prepaid cost thein asset account prepaid insurance expires part expires reported income statement insurance expense
109,sole proprietorship j lee,sole proprietorship j
110,total amount reported capital account indicate company market value,historical cost principle accounting principle total amount reported capital account indicate company market value
111,going concern assumption,going concern assumption basic underlying assumption accounting
112,role cost center profit center decentralized company,cost center profit center usually associated planning control decentralized company
113,unpaid wage,unpaid wage usually amount hourlypaid employee earned yet paid employee
114,adjust expense issuing financial statement,accomplished recording adjusting entry debit income statement account repair expense forand credit balance sheet current liability account accrued expense payable 6000
115,adjusting entry balance sheet,adjusting entry dated decemberwill debit balance sheet current asset account interest receivable forand credit income statement account investment income 5000
116,interest expense,interest expense occurring daily interest likely paid monthly quarterly semiannually annually
117,much interest expense company incur month december,however company incur onehalf month interest expense
118,gross profit margin,gross profit margin also referred gross profit percentage gross margin ratio
119,difference gross margin cost good sold,others might say company gross margin ratio 25
120,purpose income statement,purpose income statement report summary company revenue expense gain loss resulting net income occurred year quarter period time
121,income statement amount best calculated specific period time,income statement amount best calculated specific period time using accrual basis accounting
122,definition capital expenditure,amount capital expenditure recorded asset moved income statement depreciation expense year asset useful life
123,difference normal repair expense,result normal repair also reported income statement expense accounting period repair made
124,definition expense,expense many form called various namesfor example cost good sold cost service provided depreciation interest salary wage
125,debit balance,accounting bookkeeping debit balance ending amount found left side general ledger account subsidiary ledger account
126,difference cash cash account,transaction recorded cash account debit balance 4000
127,interest payable,interest payable amount interest company incurred yet paid date balance sheet
128,difference interest expense interest payable,illustrate difference interest expense interest payable let assume company borrowson novemberat annual interest rate 6
129,account wage salary ep,account wage salary expense used record amount earned employee accounting period accrual basis accounting
130,balance sheet report liability wage owed december 31,result december income statement present accurate picture december profit balance sheet report liability wage owed december 31
131,common cost flow assumption u,common cost flow assumption fifo lifo average
132,type inventory manufacturer,retailer distributor likely one type inventory namely merchandise
133,definition depreciation expense,depreciation asset used business outside manufacturing process reported depreciation expense accounting period
134,contra asset account,accumulated depreciation report total amount depreciation reported income statement time asset put service date balance sheet
135,long credit balance accumulated depreciation reach,balance accumulated depreciation reachesat end 84th month
136,definition cost,context question cost amount paid exchange material product service
137,definition cost,cost reported expense accounting period used expired future economic value measured
138,long cost hydraulic lift last,remaining useful life truck lift isyears
139,accounting equation sole proprietorship,corporation accounting equation asset liability stockholder equity
140,much money invested new business,let assume person start new sole proprietorship business investing 10000
141,accounting principle,accounting principle common rule must followed preparing financial statement distributed people outside company
142,organization accounting year end date december 31,business organization accounting year end date decemberis coincide natural business year
143,definition freight outwards,carriage outwards refers transportation cost seller must pay sell merchandise term fob destination
144,cost shipping good,supplier ship good via united parcel service cost 50
145,subsidiary ledger,significant amount detailed information needed account account receivable subsidiary ledger often used
146,much money company pay car,assume company purchased car forby paying cash ofand signing promissory note 6000
147,amount bad debt incurred,amount reported income statement account bad debt expense pertains estimated loss extending credit period shown heading income statement
148,amount account collected,balance reported balance sheet account allowance doubtful account estimated amount account receivable collected
149,much company account receivable owed,however januarythe company learns additionalof account receivable may collected
150,unpresented check,unpresented check also referred outstanding check check yet cleared bank
151,difference cash account check,hence company general ledger cash account require adjustment unpresented outstanding check reported balance sheet
152,term interest occurred paid balance sheet,interest occurred paid balance sheet date referred accrued interest
153,adjusting entry interest expense liability,interest decemberthrough decemberwasthe adjusting entry dated decemberwill debit interest expense forand credit interest payable 100
154,part stockholder equity,expense decrease corporation retained earnings decrease sole proprietor capital account
155,window dressing,window dressing refers action taken taken prior issuing financial statement order improve appearance financial statement
156,balance general ledger account,let assume company operates throughout year negative balance general ledger account cash checking account
157,balance accumulated depreciation,balance accumulated depreciation reported balance sheet separate deduction asset historical cost
158,much land reported company balance sheet,today land reported company balance sheet historical cost ofeven though current cost replacement cost inflationadjusted cost appraised value assessed value amount range fromto 270000
159,difference company accounting period year,company accounting period calendar month company accrue wage benefit earned hourly paid employee last day month
160,payroll withholding tax,payroll withholding tax tax employer required deduct employee gross wage salary bonus compensation
161,payroll tax withheld employee,tax withheld employee expense company withheld
162,difference sole proprietorship subchapter,net income sole proprietorship partnership subchapter corporation include income tax expense since owner responsible business income tax
163,difference net loss decrease owner capital,net loss cause decrease retained earnings stockholder equity
164,meaning term accounting period,however financial statement monthly accounting period likely used company management
165,example accounting period used u company,following example accounting period used u
166,longterm asset,longterm asset asset expected converted cash consumed within one year date shown heading balance sheet
167,longterm asset,longterm asset include longterm investment financial security property plant equipment intangible asset
168,definition accrued income,one example accrued income interest company earns bond investment
169,invoice,invoice received vendor billing good service provided
170,purpose supplier policy,statement supplier list amount past invoice customer paid
171,prepaid expense,prepaid expense refers amount company paid portion expense later accounting period
172,prepaid expense,company accounting year ending decemberhas prepaid expense decemberit paidfor insurance coverage decemberthrough may 31
173,prepaid expense recorded,prepaid expense recorded initially expense current asset
174,negative owner equity,negative owner equity mean amount sole proprietorship liability exceeds amount asset
175,problem negative amount owner equity,negative amount owner equity problem obvious anyone reading company balance sheet
176,difference prepaid advertising advertising expense,prepayment cost ad air future recorded current asset account prepaid advertising
177,ad cost,let assume december corporation paidmillion prepare ad book time shown super bowl game early february
178,business account debit owner equity,illustrate debit increase asset account balance assume jim start new business depositingof personal saving business checking account
179,replenishing mean,replenishing petty cash fund mean petty cash custodian request receives cash company regular checking account amount return cash hand amount shown general ledger account petty cash
180,much cash mary need return company,need obtain company check forin order cash return cash amount 100
181,reason reporting little inventory end year,inventory understated end year mean amount inventory reported le true correct amount
182,formula cost good sold,formula cost good sold cost beginning inventory cost good purchased cost good available cost ending inventory cost good sold
183,current liability company operating cycle greater one year,company operating cycle greater one year current liability obligation due within operating cycle
184,common example current liability reported company balance sheet,common example current liability reported company balance sheet include following account payable amount owed vendor supplied good service
185,accrual method accounting revenue reported income statement period,accrual method accounting revenue reported income statement period earned even though dependable customer pay companydays later
186,many day company sell good one best customer,junea company sellsof good one best customer credit term netdays
187,company receipt,company receipt refers cash company received
188,value cash sale,company make acash sale company earned revenue ofand receipt 200
189,included external financial statement issued u corporation,external financial statement issued u
190,difference paidin capital contributed capital,generally paidin capital report amount corporation received stockholder exchange newly issued share capital stock
191,retained earnings,retained earnings one component stockholder equity section corporation balance sheet
192,much company depreciate equipment,assume company depreciates equipment rate ofper year
193,type asset reported balance sheet,fixed asset one several category noncurrent asset
194,net cash flow,net cash flow combination cash received cash disbursed
195,net cash flow,net cash flow include cash inflow money received customer purchased product credit earlier accounting period cash sale occurring current accounting period money received bank loan money received disposing old asset etc
196,difference cash depreciation expense,december abco little depreciation expense mean small reduction december net income
197,required issued along income statement,result difference company net income change company cash balance statement cash flow required issued along income statement required financial statement
198,par value corporation legal capital,par value also referred corporation legal capital
199,accounting entry debit cash forand credit,example corporation issuesnew share common stock total ofand stock par value isper share accounting entry debit cash forand credit common stockparand credit paidin capital excess par 1900
200,accounting entry corporation,corporation required par value common stock corporation issuesshares forthe accounting entry debit cash forand credit common stock 2000
201,periodic system account inventory entry adjusted end,periodic system account inventory entry adjusted end accounting year report cost ending inventory
