,question,answer
1015,first step record depreciation equipment sold,assume company sell one piece equipment cost ofand accumulated depreciation ofat end previous accounting year
1016,effective interest rate bond,effective interest rate bond rate discount bond future interest payment bond maturity value present value equal bond current market value
1017,much cash investor receiving every six month,cash investor receiving isevery six month foryears thenat end ofyears
1018,common term used refer land building machinery fixed asset,common people refer land building machinery fixed asset
1019,definition fixed expense,depreciation expense associated company building machinery considered fixed cost fixed expense
1020,much fixed manufacturing overhead cost per unit applied company,situation fixed manufacturing overhead cost per unit applied rate ofper unit
1021,ratio company annual net sale net amount,fixed asset turnover ratio show relationship company annual net sale net amount fixed asset
1022,average amount net sale corporation,assume recent year corporation net sale ofmillion
1023,much money equipment account afteryears,therefore afteryears equipment account cost ofand accumulated depreciation account credit balance 150000
1024,return asset ratio regular corporation,return asset ratio regular corporation computed using tax earnings andor tax earnings
1025,average return asset year,period companysmonthly balance sheet reported average ofin total asset
1026,total asset turnover ratio,total asset turnover ratio indicates relationship company net sale specified year average amount total asset samemonths
1027,average amount asset reported themonthly balance sheet company,period company total asset reported itsmonthly balance sheet averaged 1400000
1028,much inventory reported december 31,using perpetual lifo company cost good sold inventory reported cost 32
1029,amount comprehensive income,amount reported net cumulative amount item reported comprehensive income period statement comprehensive income
1030,value net working capital company,amount may sufficient company inadequate company
1031,difference company sell fastmoving product online customer,contrast another company sell fastmoving product online customer paying credit card liquidity even small amount net working capital
1032,difference two account,balance three purchase account combined resulting amount known net purchase
1033,alternative format cost good sold,alternative format net purchase plus decrease inventory minus increase inventory cost good sold
1034,general ledger,noted company using periodic inventory system general ledger account often sophisticated inventory system outside general ledger tracking item purchase produce sell hand
1035,many day item inventory turning,word fast selling item turning everydays majority item turning average everydays 3653
1036,calculate cost company ending inventory,one method calculating cost company ending inventory tophysically count quantity item inventory thenmultiply quantity item actual unit cost
1037,common method used interim financial statement,second method used interim financial statement calculate ending inventory using quantity company inventory system
1038,much gross profit method used calculate estimated cost ending inventory,third approach use gross profit method calculate estimated cost ending inventory used interim financial statement
1039,liquidation,liquidation term commonly used describe company selling part business cash selling asset order pay debt process winding closing business
1040,much corporation pay tax,monthly financial statement corporation likely report depreciation expense offormonths
1041,quick ratio company,total company quick asset compared total current liability calculation company quick ratio
1042,gross margin ratio,gross margin ratio percentage resulting dividing amount company gross profit amount net sale
1043,true,note gross margin ratio vary industry
1044,definition contribution margin,accounting contribution margin defined revenue minus variable expense
1045,gross margin company,gross margin gross profit percentage gross profit ofdivided net sale 46
1046,company contribution margin,company fixed expense 390000
1047,much depreciation expense report company monthly income,using straightline method depreciation depreciation expense reported company monthly income statement 1000
1048,change inventory reported,change inventory reported adjustment company net income cash operating activity section scf prepared using indirect method
1049,contra revenue account,contra revenue account revenue account expected debit balance
1050,contra asset account,contra asset account asset account account balance credit balance
1051,difference period cost product cost,hence sga expense said period cost opposed part product cost
1052,difference interest expense nonoperating expense,sga include interest expense since interest expense reported nonoperating expense
1053,difference sale commission cost good sold,therefore sale commission assigned cost good held inventory cost good sold
1054,difference cash dividend cash dividend,cash dividend paid stockholder distribution corporation earnings
1055,difference earnings available common stock weighted average number,earnings available common stock divided weightedaverage number share common stock resulting earnings per share appear income statement
1056,cost good sold,manufacturer sell product forand cost good sold 28
1057,difference gross margin percentage,profit margin amount percent selling general administrative interest expense subtracted
1058,gross margin percentage company,gross margin individual product could indicate management product promoted aggressively product phased
1059,definition profit loss statement,profit loss statement pl name sometimes used describe company income statement statement income statement operation statement earnings
1060,key element profit loss statement,following example key element profit loss statement officially known income statement
1061,definition retailer operating income,retailer operating income sale minus cost good sold selling administrative expense
1062,retail operating income,using amount example retailer operating income sale ofminus cost good sold ofminus fixed variable selling administrative expense 20000
1063,difference rental cost building used manufacturing rent,rental cost building used manufacturing part manufacturing overhead
1064,difference manufacturing rent cost good sold,unit product sold manufacturing rent included product cost part cost good sold reported income statement
1065,definition nonoperating expense,nonoperating expense loss often reported income statement subtotal income operation often appear caption income
1066,definition nonoperating expense,common example nonoperating expense interest expense incurred retailer manufacturer
1067,definition term cost sale,accounting acronym co could indicate either cost sale cost service
1068,difference two statement,example income statement apple intuit report cost product cost service
1069,depreciation,depreciation nonoperating expense asset depreciated used peripheral incidental activity organization
1070,dividend reduce,since dividend expense dividend reduce corporation net income
1071,corporation reduce retained earnings stockholder equity,dividend reduce corporation net income reported income statement dividend reduce corporation retained earnings stockholder equity
1072,difference dividend earnings available common stockholder,corporation preferred stock outstanding required preferred stock dividend shown deduction earnings available common stockholder
1073,recent year earnings income tax expense,recent year earnings wereand hadshares common stock januarythrough juneandshares julythrough december 31
1074,cost good available sale year,nonmanufacturing company using periodic inventory system general ledger cost good available year sum following cost beginning inventory cost current year net purchase
1075,sga expense may appear separate amount,sga expense may appear separate amount depreciation amortization research development
1076,difference direct method indirect method presenting statement cash,main difference direct method indirect method presenting statement cash flow involves cash flow operating activity
1077,typical method presenting corporation cash flow operating activity,indirect method presenting corporation cash flow operating activity used section scf begin corporation net income
1078,common method presenting corporation cash flow operating activity,direct method presenting corporation cash flow operating activity used amount net income starting point
1079,change longterm liability stockholder equity short,financing activity reported statement cash flow involve change longterm liability stockholder equity shortterm borrowing period shown heading scf
1080,main section statement cash flow,investing activity often refers cash flow investing activity one three main section statement cash flow
1081,meaning statement,company make longterm investment security acquires property equipment vehicle expands facility etc
1082,difference interest expense cash flow statement,since company use indirect method preparing cash flow statement company interest expense contained within company net income first amount presented cash flow operating activity
1083,effect reducing inventory company cash balance,decrease inventory would reported positive amount since reducing inventory positive effect company cash balance
1084,difference interest bank loan net income,interest bank loan usually expense accounting period interest incurred
1085,common way report interest cash flow,usually done supplementary information end statement cash flow note financial statement
1086,longterm asset,longterm asset also referred noncurrent asset asset generally expected converted cash within one year balance sheet date
1087,money company receives selling one longterm asset,money company receives selling one longterm asset referred proceeds
1088,difference amount proceeds book value longterm,company sell one longterm asset amount proceeds greater book value carrying value longterm asset time sale difference gain sale disposal
1089,difference net income operating activity section cash flow statement,since gain sale included net income gain shown deduction net income reported operating activity section cash flow statement
1090,short term bank loan,shortterm bank loan generally loan must repaid within one year date balance sheet
1091,interest paid shortterm bank loan,interest paid shortterm bank loan included operating activity section statement cash flow
1092,difference interest note payable interest note payable,interest note payable reported income statement interest expense
1093,corporation prepare cash flow statement using direct method,corporation prepares cash flow statement using direct method amount interest paid appear separate line cash flow operating activity
1094,difference net loss net loss,net loss occurs company revenue gain le operating expense expense loss
1095,definition positive cash flow,section scf find reason company accounting net loss positive net cash inflow
1096,difference depreciation expense cash payment,example company purchased equipment previous year forand depreciating equipment seven year depreciation expense year income statement might 300000
1097,indirect method accounting,statement cash flow prepared using indirect method begin company net income accounting period
1098,reason company cash balance increased reported amount,result company cash balance increased reported amount net income
1099,difference cash amount ofand accrual accounting net income,hence positive adjustment ofconverts accrual accounting net income ofto cash amount 5900
1100,positive adjustment,increase account payable positive adjustment paying bill good company cash balance
1101,difference cash company generates company net,cash company generates different company net income
1102,difference free cash flow calculation requirement,variation calculation also subtract dividend stockholder dividend viewed requirement
1103,first section cash flow statement,assume company cash flow statement first section report company net cash provided operating activity 325000
1104,capital expenditure,capex shortened form term capital expenditure capital expenditure
1105,long take company recoup investment,us potential investment undiscounted cash flow calculate number year take company recoup investment
1106,cash saving second project,let assume company invests cash ofin efficient equipment
1107,markup dollar,note retailer may use term markup mean additional markup earlier selling price
1108,difference markup ofand price 8,therefore themarkup divided product cost ofresults markup isof cost
1109,average collection period,average collection period average number day betweenthe date credit sale made andthe date money receivedcollected customer
1110,average collection period,alternate formula calculating average collection period average account receivable balance divided average credit sale per day
1111,many day average credit sale per day take collect,using alternate formula first determine average credit sale per day theof credit sale divided bydays 1096
1112,pro forma financial statement,pro forma financial statement one based certain assumption projection
1113,definition pro forma financial statement,projected financial statement referred pro forma financial statement
1114,common accounting ratio used financial analysis company,company accounting ratio compared ratio company industry
1115,time interest earned ratio measure corporation ability make,larger time interest earned ratio likely corporation make interest payment
1116,trading equity,trading equity also referred financial leverage occurs corporation us bond debt preferred stock increase earnings common stock
1117,limit much debt added corporation financial future,limit proportion debt added corporation financial future jeopardized
1118,definition turnover ratio,turnover ratio indicate efficiency effectiveness company management
1119,inventory turnover low day sale inventory high,instance inventory turnover low day sale inventory high
1120,definition constant quantity item inventory,assume company maintains constant quantity item inventory
1121,difference percentage base year percentage,analysis financial information trend analysis presentation amount several year expressed percentage base year
1122,trend service company revenue net income number,assume want see trend service company revenue net income number client yearsthrough 2023
1123,inventory turnover ratio,company inventory turnover often expressed company cost good sold year divided average cost inventory year
1124,effect slowing conversion inventory item cash,inventory item slow converted cash company money sitting good instead company checking account used pay supplier employee lender others
1125,interest coverage ratio,interest coverage ratio computed dividinga corporation annual income interest income tax expense byits annual interest expense
1126,difference bond payable longterm debt,context bond refers bond payable form longterm debt typically promise pay interest every six month principal amount specified maturity date
1127,difference interest rate rate corporation income tax,corporation income tax rate increment isthe corporation save paying income tax 240000
1128,drawback roi,drawback roi accounting amount revenue expense asset book value etc
1129,difference income statement benefit amount spent,situation income statement benefit related amount spent
1130,financial ratio return equity,financial ratio return stockholder equity calculated dividing corporation net income income tax average amount stockholder equity period net income
1131,return stockholder,equity wasat beginning year wasat end year increase occurred uniform rate throughout year
1132,unexplained difference accountant state bank statement,unexplained difference accountant state bank statement reconciled
1133,difference company cash account bank,note balance different company general ledger cash account balance 7000
1134,bank credit memo,bank credit memo item company bank account statement increase company checking account balance
1135,outstanding check,outstanding check check company issued recorded general ledger account check yet cleared bank account drawn
1136,bank reconciliation mean,outstanding check previous month clear bank mean bank paid check check appear deduction statement
1137,difference bank reconciliation general ledger account,adjustment result item appearing bank statement recorded company general ledger account
1138,deposit transit,deposit transit also known outstanding deposit
1139,reason bank statement report thea june 30,done theis rightfully included company general ledger junebut theis reported bank statement june 30
1140,item bank reconciliation require journal entry,item appear bank statement yet recorded company general ledger account
1141,outstanding deposit,outstanding deposit refers company receipt cash check customer etc
1142,amount money reported part company cash balance,thisshould reported part company cash balance october 31
1143,meaning bank overdraft,check paid bank bank checking account negative balance
1144,happens bank return check endorserspayees,cause company incur two bank fee bank returning two check endorserspayees
1145,process reconciling checking account balance bank record,part internal control company reconcile checking account balance general ledger account balance bank record
1146,difference checking account checking account,company often several checking account
1147,bank reconciliation,balance company checkbook mean comparing amount bank statement amount company checkbook check register related general ledger account arriving correct balance record
1148,main topic article,thorough discussion example balancing checkbook see major topic bank reconciliation bank reconciliation business form referenced
1149,meaning per annum,often per annum omitted amortgage loan
1150,compute rate per annum,compute rate per annum restate amount multiplying theand thedays 18
1151,early payment discount,seller may refer early payment discount sale discount
1152,difference early payment discount credit card,let assume company sell good credit offer early payment discount expressed asnet 30
1153,direct writeoff method financial reporting,reason accounting profession allow direct writeoff method financial reporting
1154,annualizing,annualizing mean taking partial year amount converting full year amount
1155,irrevocable letter credit,irrevocable letter credit assures seller paid bank buyer fails pay
1156,selling price product,retailer want earn positive gross margin selling price must include additional amount added retailer cost product
1157,job costing system,job order costing job costing system assigning accumulating manufacturing cost individual unit output
1158,purpose cost accounting,example bank use cost accounting determine cost processing customer check andor deposit maintaining checking account processing international wire transfer servicing mortgage loan etc
1159,definition direct labor,example direct labor employee working assembly line manufacturer
1160,cost good manufactured,calculation presented schedule statement
1161,salary,salary wage form compensation paid employee company
1162,accounting method salary wage company employee working non,salary wage company employee working nonmanufacturing function e
1163,salary wage people nonmanufacturing function selling,salary wage people nonmanufacturing function selling general administrative etc
1164,difference decrease inventory decrease inventory,increase inventory subtracted company purchase good decrease inventory added company purchase good arrive cost good sold
1165,common method presenting cost good sold income statement,common method presenting calculation cost good sold income statement purchase ofminus increase inventory 990
1166,difference cost good sold cost item added,purchase added inventory part cost good sold
1167,definition manufacturing cost,manufacturing cost cost material plus cost convert material product
1168,two cost flow assumption used cost accounting textbook,cost accounting textbook likely present cost calculation per equivalent unit production two cost flow assumption weightedaverage fifo
1169,direct labor cost per unit month june,department direct labor cost wasduring month june direct labor cost per equivalent unit 10
1170,cost good sold,inflation retailer must also elect cost flow assumption order determine cost ending inventory course factor calculation cost good sold
1171,optimum quantity item purchased one time,eoq acronym economic order quantity
1172,much cost carry one unit inventory,company incremental cost process order isand incremental annual cost carry product inventory isper unit
1173,standard cost,standard cost often integral part manufacturer annual profit plan operating budget
1174,amount workinprocess inventory manufacturer balance sheet,amount workinprocess inventory would reported along raw material inventory finished good inventory manufacturer balance sheet current asset
1175,difference workinprogress constructionin,use term workinprogress mean construction long term asset yet completed
1176,gross profit method estimating ending inventory,gross profit method estimating ending inventory assumes gross profit percentage gross margin ratio known
1177,much cost company inventory,assume need estimate cost company julyinventory
1178,two cost flow assumption used u company inventory item,fifo lifo two cost flow assumption used u
1179,difference positive gross profit negative operating income,result larger gross profit positive operating income
1180,company use cost flow assumption,another reason company use lifo cost flow assumption improve matching cost sale
1181,cost flow assumption,fifo cost flow assumption oldest cost inventory item first cost removed inventory reported cost good sold
1182,many unit left inventory,therefore beunits remaining inventory
1183,definition production cost,managerial accounting cost accounting production cost cost occur manufacturing facility
1184,gross profit method,gross profit method technique used estimate amount ending inventory
1185,gross profit method,let assume previous inventory amount wasand purchase 75000
1186,definition workinprocess inventory,workinprocess inventory pertains good manufacturing begun yet completed
1187,cost good workinprocess,generally amount workinprocess relatively small compared manufacturer cost good sold finished good inventory
1188,definition inventory shrinkage,inventory shrinkage term describe loss inventory
1189,many unit product x hand,assume retailer computerized inventory record indicates thatunits product x hand
1190,safety stock,company manufacturer safety stock material could minimize risk production disrupted
1191,risk company increasing safety stock peak sale period,demand constant company could increase quantity safety stock peak sale period reduce quantity period low sale
1192,cost flow assumption used company,much depend cost flow assumption used
1193,meaning fifo,economist may state larger profit using fifo illusory since good replaced higher current cost
1194,best way avoid paying income tax illusory profit,avoiding paying income tax illusory profit give company money required replace good new inflated cost
1195,lower income mean,corporation end lower taxable income likely mean lower income tax expense
1196,much cost theunits sold,using lifo cost flow assumption cost theunits sold using fifo cost flow assumption cost theunits sold gross profit using lifo sale cogsgross profit using fifo sale cogsnote lifo gross profit isle fifo gross profit
1197,example expense assigned product,cost advertising preparing invoice delivery expense office salary office rent utility interest loan example expense assigned product
1198,cost product known,word cost product known precision even though accountant compute per unit cost nearest penny
1199,difference material usage variance standard quantity direct material used,material usage variance result using le standard quantity direct material used actual good produced
1200,difference workinprocess inventory finished good inventory,significant variance caused inefficiency may divided workinprocess inventory finished good inventory cost good sold
1201,cost missing inventory,approximate cost missing inventory difference betweenthe cost inventory item physically present accounted andthe cost inventory hand based accounting information
1202,determine cost missing inventory,company accounting record inventory system us perpetual inventory system determining cost missing inventory easy
1203,much company carry additional increment inventory,company estimated annual cost carry additional increment inventory beof item cost
1204,acronym lastin first,lifo acronym lastin firstout
1205,cost inventory end 2023,lifo cost flow assumption theunits sold would consist cost recently purchasedunits atplus cost ofunits purchased inateach
1206,reorder point,reorder point quantity unit inventory time order placed purchase additional unit
1207,many unit company need order,assume company determined reorder point product x isunits economic order quantity isunits
1208,book depreciation,book depreciation amount recorded company general ledger account reported company financial statement
1209,much depreciation expense recorded general ledger account reported,company assumes salvage value end theyears annual depreciation expense recorded general ledger account reported financial statement likely beeach year
1210,difference tax regulation book depreciation,tax regulation specify useful life asset also allow accelerated depreciation immediate expensing certain amount company tax return
