,question,answer
815,reason cash received today invested immediately begin growing value,reason cash received today invested immediately begin growing value
816,value 11000,assume company provides consulting service today agrees receiveone year later
817,accountant ignore time value money routine account receivable,however concept materiality costbenefit allow accountant ignore time value money routine account receivable account payable credit term ofordays
818,definition significant event,instance company balance sheet date december2023 time financial statement distributed january2024 possible significant event occurs information becomes known important user decemberfinancial statement
819,best way illustrate first situation,illustrate first situation assume customer owes corporationon decemberand corporation believed customer receivable would collected full
820,difference actual cost standard cost,standard costing used manufacturer general ledger account inventory cost good sold contain standard cost
821,cost principle corporation,comply gaap cost principle corporation must allocate theto inventory cost good sold reporting financial result
822,debtor property located,lien likely filed county government office debtor property located
823,accountant new information released,based new information accountant write adjusting entry debit bad debt expense forand credit allowance doubtful account 15000
824,definition manufacturing overhead,manufacturing overhead cost also known factory overhead cost burden indirect manufacturing cost indirect product cost
825,arm length transaction,arm length transaction exists two independent party attempting get best deal possible
826,company inform daughter house cost 225000,hand daughter company owner want company build house person company may inform daughter house cost 225000
827,deferred asset,might consider deferred asset prepaid expense qualify reported current asset
828,purpose sentence,assume electric utility spentfor project abandoned
829,order good physically removed inventory agree order,important understand cost flow agree order good physically removed inventory
830,summary significant accounting policy used corporation,inventory method cost flow assumption used corporation found corporation summary significant accounting policy contained annual report security exchange commission form 10k
831,difference present value future cash amount,accounting present value refers amount discounting future cash amount present
832,difference interest income discount receivable,wsc earns theof interest next two year credit interest income debit discount receivable
833,product cost retailer,example retailer paysto supplier paysto get delivered warehouse retailer product cost 50
834,manufacturer product cost,manufacturer product cost includes cost product raw material plus cost converting raw material product
835,good sold product cost removed inventory appear,good sold product cost removed inventory appear income statement cost good sold
836,cost retailer andor manufacturer,selling general administrative interest cost retailer andor manufacturer product cost
837,difference fifo lifo,first cost inventory item never change difference whether fifo lifo used
838,difference two tax rule,tax rule also allow either fifo lifo require cost flow assumption used company tax return company financial statement
839,preferred method capital budgeting decision,since investment impact many year preferred method capital budgeting decision use discounted cash flow
840,form 10k,form 10k required annual report filed u
841,review form 10k,corporation website select investor relation page select annual report report sec
842,purchase discount lost account,account purchase discount lost general ledger account used company record vendor invoice using net method
843,policy retailer,assume retailer policy always pay vendor legitimate invoice within early payment discount period discount offered
844,recipient external financial statement,external financial statement distributed outside company management
845,financial statement corporation,external financial statement u
846,definition nonoperating activity,transaction outside company main business activity referred nonoperating activity
847,difference sale old delivery van sale merchandise,therefore sale van included sale merchandise
848,gain sale van,since transaction main business activity retailer since theof cash received greater net cost ofbeing removed account retailer report nonoperating item described gain sale van 1500
849,obsolete inventory,obsolete inventory refers product company purchased produced sold
850,accounting rule require cost obsolete inventory item reduced net,accounting rule require cost obsolete inventory item reduced net realizable value
851,value obsolete item,since value obsolete item may continue decrease wise dispose item price soon possible
852,definition term opportunity cost,refer opportunity cost opportunity lost
853,much money lose friend work,however friend work lost opportunity earn additional 4500
854,calendar year,calendar year theconsecutive month january december
855,year u corporation file personal income tax return,individual file personal income tax return based calendar year januarythrough december 31
856,noncalendar accounting year,example u
857,accounting,accounting recording financial transaction along storing sorting retrieving summarizing presenting result various report analysis
858,definition report,external report must prepared accordance generally accepted accounting principle often referred gaap u gaap
859,purpose accounting,another part accounting focus providing company management information needed keep business financially healthy
860,difference dividend expense,important note dividend declared paid corporation expense corporation
861,ratio account receivable turnover,calculation account receivable turnover ratio credit sale year divided company average amount account receivable throughout year
862,many time year company account receivable turnover change,result account receivable turnover ratio credit sale ofdivided average amount account receivable oftimes year
863,access company detail,therefore access company detail review detailed aging account receivable discover past due account
864,current ratio,current ratio proportion quotient relationship amount company current asset amount current liability
865,best way compare company current ratio ratio earlier,also wise compare company recent current ratio ratio earlier date
866,definition cash operating activity,cash operating activity focus cash inflow outflow company main business activity buying selling merchandise providing service etc
867,u cash operating activity presented using either,u
868,financial reporting include,financial reporting includes company communication financial information people outside company
869,liquidity ratio,liquidity ratio financial ratio indicates whether company current asset sufficient meet company obligation become due
870,difference company balance sheet earnings,generally corporation earns revenue increase current asset increase retained earnings component stockholder equity
871,effect sale account corporation retained earnings,however sale account temporary account effect increasing corporation retained earnings
872,compilation report,compilation report accompany compiled financial statement indicate financial statementsare representation company management andhave reviewed audited therefore accountant offer opinion assurance financial statement
873,bank require borrower incur expense cpa review,bank require borrower incur expense cpa review audit
874,statement comprehensive income,statement comprehensive income one five financial statement required complete set financial statement distribution outside corporation
875,consolidated financial statement,consolidated financial statement financial statement group separate legal entity controlled one company
876,purpose consolidated balance sheet nep,consolidated balance sheet nep report cash receivables plant etc
877,debt equity ratio,debt equity ratio debtequity ratio result dividing corporation total liability total amount stockholder equity
878,much debt equity ratio corporation,corporation total liability ofand stockholder equity ofwill debt equity ratio 31
879,rolling budget,rolling budget often refers company operating budget present future monthly budget nextmonths
880,benefit rolling budget,benefit rolling budget company management always budget look forward one full year
881,tax profit margin ratio,tax profit margin ratio express company net income earnings percent company net sale
882,statement stockholder equity,financial statement summarizes one page change occurred stockholder equity account accounting year
883,difference direct method indirect method,summary difference two method preparing statement cash flow please click following difference direct method indirect method
884,long company receives money,juneuntil company receives money company account receivable
885,common method calculating accelerated depreciation,sumoftheyearsdigits depreciation one method calculating accelerated depreciation
886,value sum digit year asset,instead adding individual digit year asset useful life following formula used compute sum digit n divided bywhere n useful life year
887,bad debt,term bad debt usually refers account receivable collected
888,deferred expense,accomplish deferred expense reported balance sheet asset contra liability moved balance sheet income statement expense
889,name account used recording current period expense associated,provision doubtful debt name account used recording current period expense associated loss normal credit sale appear operating expense company income statement
890,difference amount last period ending inventory amount,inventory change difference amount last period ending inventory amount current period ending inventory
891,alternative method used introductory accounting textbook,alternative method used introductory accounting textbook beginning inventory net purchase ofof cost good available ending inventory cost good sold 285000
892,utility bill,utility bill invoice received company natural gas electricity water sewer charge company used previous month period time
893,utility bill available retailer record accrual adjusting entry,utility bill december usage available time retailer financial statement prepared retailer record accrual adjusting entry debit utility expense credit accrued utility payable december estimated amount
894,amount invoice collected,estimated amount collected credit balance contra asset account allowance doubtful account
895,much balance company account receivable,result balance sheet reporting account receivable 82000
896,noncash expense,noncash expense expense reported income statement current accounting period related cash payment took place another accounting period
897,common example noncash expense,depreciation expense referred noncash expense
898,allowance uncollectible account,income statement account bad debt expense part adjusting entry increase balance allowance uncollectible account
899,company delaying reporting bad debt expense account receivable,hence income statement delaying reporting bad debt expense income statement account receivable actually written uncollectible
900,deferral,deferral often refers amount paid received amount reported current income statement since expense revenue future accounting period
901,much insurance premium deferred liability account,remainingis deferred reporting current asset prepaid insurance decemberbalance sheet
902,principal payment required loan come due,principal payment required loan come due
903,interest rate month,assume julya company borrowswith annual interest rate 12
904,deferred cost,deferred cost cost already recorded company account least cost expensed future accounting period
905,reason company balance sheet reportas current asset,therefore decemberthe company balance sheet reportas current asset prepaid insurance
906,meaning bad debt doubtful debt,accounting term bad debt doubtful debt usually refer amount owed company customer purchased good service amount likely uncollectible
907,company current asset account,accounting purpose company establish current asset account entitled allowance doubtful account allowance uncollectible account
908,promissory note,note payable note receivable associated written note promise repay amount borrowed plus interest
909,bank record thepromissory note,assume local retailer borrowsfrom bank sign promissory note due six month
910,deferral adjusting entry,deferral adjusting entry pertains transaction already recorded general ledger account
911,company current asset prepaid expense,januarythe company report month january maintenance expense ofand current asset prepaid expense debit balance 11000
912,maintenance service company current liability account,maintenance service company recorded transaction decemberwith debit cash forand credit current liability account deferred revenue 12000
913,short answer question,short answer corporation financial statement prepared using accrual method accounting employee payroll record internal revenue service requires cash method accounting
914,retailer begin operation,illustrate let assume new retailer begin operation december 27
915,amount reported irs,retailer payroll department must report irs wage paid
916,meaning financial leverage,use financial leverage control greater amount asset cause return owner cash investment amplified
917,much money use buyacres land,sue usesof cash borrowsto purchaseacres land total cost 1500000
918,much land mary sue sell one year,example let assume one year land owned mary land owned sue increased value byand mary sue sold land investment market value
919,debt total asset ratio,note debt includes loan bond payable
920,debt total asset ratio corporation,let assume corporation hasmillion total assetsmillion total liability andmillion stockholder equity
921,length operating cycle used place oneyear time period,company operating cycle longer one year length operating cycle used place oneyear time period
922,vertical analysis,vertical analysis express amount financial statement percentage another amount
923,percentage commonsize balance sheet allow compare small company,percentage commonsize balance sheet allow compare small company balance sheet large company balance sheet
924,much cost good sold,cost good sold amount isit presented 78
925,meaning horizontal analysis,horizontal analysis also referred trend analysis
926,difference cost good sold net sale,easy detect year cost good sold increasing faster pace company net sale
927,current asset,however company operating cycle longer one year asset expected turn cash within longer operating cycle current asset
928,many day take collect account receivable,day sale account receivable ratio tell number day took average collect company account receivable past year
929,many day year sale account receivable divided,day sale account receivable calculated follows number day year divided account receivable turnover ratio past year
930,much money account receivables aging,upon checking company belief thatof receivables never collected
931,quick ratio,quick ratio calculated dividing amount quick asset bythe amount current liability
932,reason inventory might quick turn cash,reason inventory might quick turn cash
933,definition security deposit,landlord receives hold security deposit report amount liability
934,landlord liability account,landlord debit cash forand credit liability account refundable security deposit 1000
935,net working capital,net working capital amount remaining subtracting company total amount current liability total amount current asset
936,reason decrease current liability,company obtains longterm loan replace current liability current liability decrease current asset change
937,depreciation expense asset recorded,order know asset book value time sale depreciation expense asset must recorded right date asset sold
938,much cash received company sale old delivery van,since theof cash received company greater van book value ofthere gain sale van 2600
939,cause negative cash balance company general ledger,negative cash balance result cash account company general ledger credit balance
940,logic company check,logic company likely issued check reduce account payable
941,construction workinprogress account,account construction workinprogress debit balance reported balance sheet part company noncurrent longterm asset section entitled property plant equipment
942,long take expand warehouse,let assume company expanding warehouse project expected take four month complete
943,difference expenditure get machine back previous working condition,hand expenditure get machine back previous working condition capitalized
944,term carrying amount,term carrying amount often used valuation account associated another general ledger account
945,many day year company sell inventory,calculation day sale inventory number day year divided inventory turnover ratio
946,many day company inventory,usingas number day year company day sale inventory wasdays
947,meaning term net realizable value,net realizable value cash amount company expects receive
948,resulting net realizable value account receivable,account receivable debit balance ofand allowance doubtful account proper credit balance ofthe resulting net realizable value account receivable 92000
949,drawing,webb draw l
950,account l webb draw money,webb drawsof cash business accounting entry debit ofto account l
951,impact owner drawing statement cash flow,owner drawing cash also affect financing activity section statement cash flow
952,principal part note receivable expected collected,principal part note receivable expected collected within one year balance sheet date reported current asset section lender balance sheet
953,happens company borrowsfrom bank,company borrowsfrom bank sign promissory note payinterest quarterly principal amount inmonths bank debit current asset account note receivable credit cash customer deposit principal amount 100000
954,long company pay principal,company industry operating cycle longer one year report amount principal due within length operating cycle current liability
955,current liability section balance sheet,remaining amount principal due balance sheet date reported noncurrent longterm liability
956,working capital turnover ratio,working capital turnover ratio calculated follows net annual sale divided average amount working capital year
957,working capital turnover ratio,financial ratio compare working capital turnover ratio company industry company past planned working capital turnover ratio
958,definition plant asset,plant asset related accumulated depreciation reported company balance sheet noncurrent asset section entitled property plant equipment
959,par value share common stock,case common stock par value per share usually small amount 0
960,par value share common stock,let assume share common stock par value 0
961,mortgage loan payable,account mortgage loan payable contains principal amount owed mortgage loan
962,much principal due mortgage loan,remaining principal reported longterm liability since amount due within one year balance sheet date
963,difference amount received corporation issuing bond par value,premium discount bond payable difference amount received corporation issuing bond par value face amount bond
964,much interest expense reported bond yet amortized,premium discount bond payable yet amortized interest expense reported immediately par value bond liability section balance sheet
965,difference book value fair market value,important realize book value fair market value accountant historical cost principle matching principle
966,book value corporation bond,corporation balance sheet report stockholder equity ofthe corporation book value amount
967,current market value indicate current market value,book value indicate current market value
968,percentage sale commission revenue,company person earning receiving commission commission revenue
969,difference accrual basis accounting revenue basis,accrual basis accounting commission received order reported revenue
970,difference commission owed commission payable,company owes commission recent sale yet paid recorded accrual adjusting entry made included commission expense reported income statement also reported commission payable balance sheet
971,reason company want financial income tax reporting use lifo,company accounting system us fifo company want financial income tax reporting use lifo due persistent increase cost inventory item
972,definition fixed asset,word fixed indicates asset used consumed sold current accounting year
973,connection inventory cost good sold,show connection inventory cost good sold let assume retailer sell one product
974,much acid test ratio,company current liability amount tothe acid test ratio 1
975,simplest way record issuance bond,assume corporation issuesmillion bond payable annual interest rate 5
976,many time company sold inventory,result average number time company inventory sold
977,inventory turnover ratio,calculation inventory turnover ratio cost good sold year divided average inventory samemonths
978,many time company inventory turnover ratio change last year,result company inventory turnover ratio cost good sold ofdivided average inventory oftimes recent year
979,cost company inventory,overstating inventory mean reported amount cost company inventory greater actual true cost based accounting rule
980,meaning common stock,owner common stock referred common stockholder common shareholder simply stockholder shareholder
981,percentage corporation owned stockholder,stockholder ownsshares common stock stockholder ownsof corporation
982,effect interest expense corporation bond debt,interest corporation bond debt expense corporation reduces corporation net income
983,difference interest line income tax expense,thewill appear corporation income statement interest expense reduce line net income income tax expense line income tax expense
984,difference fifo lifo,company may elect either fifo fifo cost flow assumption
985,many unit sold year,thus year retailer purchasedunits total actual cost 3870
986,debt ratio,hence formula debt ratio total liability divided total asset
987,corporation debt ratio,corporation debt ratio 0
988,difference expected future cost repairing replacing product,note expected future cost repair replace matched sale revenue period sale
989,much labor part automobile manufacturer spend repair,assume automobile manufacturer found spendsin labor part necessary repair covered two year warranty
990,difference current ratio quick ratio,illustrate difference current ratio quick ratio assume company balance sheet report current asset ofand current liability 40000
991,liquidity ratio,liquidity usually refers company ability pay bill become due
992,order liquidity,generally asset expected turn cash within one year reported balance sheet section heading current asset
993,long take convert inventory cash,account receivable may converted cash intodays
994,current ratio affect liquidity company,liquidity depends speed inventory converted cash
995,difference number share issued number share outstanding,number share treasury stock difference number share issued number share outstanding
996,many share common stock corporation buy,result decides purchaseshares itsshares common stock held stockholder
997,common way finance new power plant,example profitable public utility might finance half cost new electricity generating power plant issuing 30year bond
998,sinking fund part working capital corporation,therefore sinking fund current asset part corporation working capital
999,much abc corporation invest sinking fund,independent trustee invest corporation annual deposit goal sinking fund balance growing approximatelymillion time bond come due inyears
1000,difference capital expenditure cash flow,amount capital expenditure accounting period also reported cash flow statement negative amount investing activity section
1001,meaning term bond sinking fund,bond sinking fund noncurrent asset even fund contains cash
1002,day sale outstanding,account receivable collection period similar day sale outstanding day sale account receivable
1003,many day credit sale corporation past year,average credit sale per day approximatelyper day
1004,two metric used determining company ability meet,metric useful determining company ability meet current shortterm obligation
1005,difference mortgage principal balance longterm liability,possible mortgage principal balance ofwill mean current liability ofand longterm liability 135000
1006,change affect net income,since oci item affect net income cause change corporation retained earnings
1007,difference current ratio working capital,illustrate difference current ratio working capital assume company balance sheet report current asset ofand current liability 40000
1008,root cause discount bond payable,root cause bond discount bond stated interest rate lower market interest rate similar bond
1009,difference initial debit balance credit balance discount bond pay,life bond initial debit balance discount bond payable decrease amortized bond interest expense
1010,direct material bakery product,direct material bakery product likely flour sugar egg milk vegetable oil spice ingredient listed bakery recipe
1011,working capital ratio,working capital ratio defined amount company current asset divided amount current liability
1012,much cash company,whether ratio good bad sufficient insufficient etc
1013,term solvency mean,company solvency also risk unable operate profitably
1014,definition leverage,accounting finance leverage use significant amount debt purchase asset operate company acquire another company etc
