,question,answer
602,definition professional judgment,suppose condition accountant prepared financial statement auditor check information financial statement true flawed misstatement
603,skepticism,professional skepticism state mind ready situation grab error question financial event event conducting assurance engagement
604,qualified opinion,circumstance qualified opinion given
605,ratio sample estimate population total,ratio sample estimate population total used adjust sample estimate variable interest
606,risk material misstatement,risk material misstatement refers risk financial statement materially misstated present true fair view
607,professional financial company provides type financial service client including risk,founded inand headquartered london rsm professional financial company provides type financial service client including risk management financial management tax advisory
608,definition sampling error,however using sampling data involves risk result found analysis might represent result would acquired using data involving whole population sample derived
609,difference auditor opinion opinion entire population,sampling risk risk auditor opinion would different procedure applied entire population data
610,sarbanesoxley act,commonly known public company accounting reform investor protection act corporate auditing accountability responsibility act sarbanesoxley act implemented july2002
611,name company,founded glasgow yearsmith williamson catered various financial business need customer providing great advisory chartered accountant service client
612,provides auditing report submit report law concerned municipal law authority,company auditor provide auditing report submit report annually semiannually law concerned municipal law authority
613,statutory auditor,statutory auditor country referred external auditor external public accountant certified
614,meaning unqualified opinion,judgment independent author financial record statement company presented appropriately fairly accordance generally accepted accounting principle called unqualified opinion
615,main objective auditing,term vouching core thing auditing refers inspecting documentary evidence auditor support substantiate transaction
616,purpose appraisal institute,work towards making appraisal system transparent support equal opportunity fairness profession appraisal
617,main task appraisal standard board,main task appraisal standard board performs developing interpreting amending uniform standard professional appraisal practice done behalf user appraiser appraisal service
618,appraiser,appraiser professional certified estimate worth value item thing
619,difference approach value sale comparison approach,different property different approach value used
620,cost approach value,cost approach value one approach value used determining value property
621,income approach value,income approach value also known income capitalization approach used determine value income generating property deriving value indication conversion expected benefit like cash flow reversion value property
622,role international valuation standard council,sincethe international valuation standard published international valuation standard council
623,difference business expected close function continuously,going concern valuation mean value business expected close function continuously
624,project appraisal,project appraisal structured process assessing viability project proposal
625,difference valuation special case,therefore valuation become special case effective insurable value property estimated
626,difference real estate appraisal land valuation,type appraisal market value property usually required
627,term residual income,word residual refers opportunity cost excess measured compared book value shareholder equity income firm generates accounting true cost capital residual income
628,role royal institution chartered surveyor,royal institution chartered surveyor professional representative independent body work control surveyor property professional u
629,value property,sale comparison approach determines value property comparing similar property vicinity recently sold along proper adjustment acreage size amenity time etc
630,appraisal foundation formed 1987,formation appraisal foundation inwas due flux arising business relating mortgage lending real estate
631,definition term,uniform standard professional appraisal practice kind quality control standard u
632,example intangible asset,example intangible asset goodwill trademark patent
633,valuation technique,valuation using multiple often known relative valuation technique used making estimate value asset done making comparison asset value value similar asset comparables analyzing market
634,definition valueinuse asset,valueinuse asset net present value cash flow benefit generated asset certain use certain owner
