,question,answer
404,adhocracy,term adhocracy commonly defined form organization operates differently normal bureaucratic line explore opportunity resolve issue get better outcome
405,definition arbitrage,finance arbitrage refers practice taking advantage difference price two market striking arrangement matching deal capitalize upon difference profit difference market price
406,role asset reconstruction authority world,different company established asset reconstruction restructuring authority organization several country
407,difference two type balance theory,balance theory might two type credit balance theory debit balance theory
408,bare trust,bare trust defined basic trust beneficiary complete right asset within trust along income generated asset
409,definition barter,barter system generally bilateral might also multilateral large exists parallel monetary system developed country although limited extent
410,definition benchmark interest rate,various bank world given benchmark rate interest
411,beneficiary trust law,trust law known cestui que use beneficiary natural person entity legal stature entitled receive money assistance another person known benefactor
412,bond,bond refers debt investment wherein investor lends money business company borrows fund specific time period fixed interest rate
413,bribery,bribery defined gift granted individual community organization person granted gift ask favor
414,bridge loan,basically bridge loan interim financing strategy based loan offer financing individual business
415,budget constraint,budget constraint refers combination good service purchased consumer income given price
416,budgetary slack,budgetary slack allowance set extra expenditure entity going incur fore coming period
417,burn rate,burn rate term used synonym cash flow negative opposite direction
418,business plan,business plan decision making tool delineated formal statement set business goal reason achievable plan achieving goal
419,process assessing redesigning flow work within business,process assessing redesigning flow work within business business known business process reengineering
420,term capital account,term capital account used frequently field macroeconomics international finance monetary matter
421,meaning capital accumulation,say investment made realizing financial profit
422,test annual impairment,basically unit account subjected testing annual impairment exists banking system account
423,difference cash payment delivery,transaction element fully satisfied cash payment delivery take place time
424,definition low jeopardy investment,financier looking low jeopardy investment suppose held development numerous cd would yield full quantity innovative speculation even organization delivering certificate deposit breakdown
425,typical clause employment contract,typical one added frequently major employment contract firm company
426,cofinancing term,basically official term cofinancing concerned designing certain arrangement according one party collaborate contribute towards funding
427,collateral,collateral refers asset property presented secure loan credit
428,collateralized mortgage obligation,collateralized mortgage obligation basically kind security mortgage backing establishes separated pool passthrough rate multiple bondholder class variety maturity known tranche
429,collection agency,collection agency business oriented agency concerned collection money debt lender ad company
430,commitment letter,commitment letter formal letter issued lending authority order inform loan applicant term condition getting loan credit
431,commodity paper,commodity paper defined loan advance issued borrower lender part raw material owned borrower serve collateral body people
432,role commodity product spread purchase given tangible,involvement commodity product spread purchase given tangible intangible commodity result purchase subsequent sale product commodity product spread
433,conversion cost,conversion cost defined sum cost incurred carrying conversion article intended output
434,difference bond valuingandcommon stock share,bond valuingwhich convertible intocommon stock share ofeach sell aconversion premium of1500
435,corporate finance specialist,corporate finance specialist assist firm evaluation operating data industry indicator addition providing advice management budget adjustment decision regarding general investment
436,cost benefit analysis,cost benefit analysis refers systematic process used calculate compare cost benefit project decision government policy
437,cost effectiveness analysis assign monetary value measuring effect,unlike cost benefit analysis cost effectiveness analysis assign monetary value measuring effect
438,covenant,covenant generally refers promise agreement formal debt indenture certain activity conducted
439,credit cooperative scheme china,sanctioned cooperative union enables citizen get credit
440,definition credit crunch,may also defined sudden restriction tightening term condition required obtaining loan bank
441,credit limit,credit limit defined maximum amount credit withdrawn debt financial institution bank
442,common form credit line expansion restriction,common form credit line expansion restriction include loan demand protection overdraft specific purpose export packing credit many attribute
443,definition credit rating agency,different kind rating included regard
444,difference cumulative preferred stock common stock,known cumulative preferred stock
445,debenture,debenture instrument backed credibility issuer market physical asset
446,cause deflation,deflation may also caused decrease spending includes government private sector spending
447,purpose discretionary trust,discretionary trust provides trustee power decide come conclusion regard beneficiary would receive fund amount fund heshe would get
448,difference divesture sale,process carried either social financial goal
449,dutch auction,bid made first considered winning bid transforms sale assumption bidding price reserve price
450,escrow,escrow basically type arrangement made per provision laid contract party transacting wherein independent 3rd party get disburses fund orand document behalf party transacting disbursement timing 3rd party depending fulfilling condition listed contract party transacting
451,definition exploration expenditure,exploration expenditure comprises expenditure excluded expenditure incurred taxpayer exploration petroleum eligible recovery exploration area relation petroleum project
452,difference factor cash advance,balance purchase price along net factor discount fee charge paid upon collection
453,definition money surrogate,moreover money surrogate way instrument capital account market created transacting trading asset liability risk
454,branch finance,involves planning organizing directing controlling financial activity business firm like procurement utilization fund business firm
455,franchise,definition franchise form business organization firm already successful good product service called franchisor get contract based relationship another business called franchisee operates name franchisor fee
456,franchise,franchisee may operate franchisors name carry separate business within perimeter set franchisor
457,definition fraud,actually tricky unlawful way obtain something
458,free price system,term free price system refers economic system price decided exchange demand supply price resulting taken signal communicated consumer producer help guiding production distribution resource
459,wage garnishment,process withholding remittance order court known wage garnishment
460,gemckinsey matrix,gemckinsey matrix form analysis using portfolio outlay strategic unit business position sbu industry
461,meaning golden parachute,golden parachute provided mostly executive employee benefit significant noteworthy
462,grace period,word grace period extension period provided borrower good
463,definition grey market,grey market similar term black market
464,definition gdp,actual definition gross domestic product given financial value finished good service generated within nation border certain time period though gdp generally evaluated yearly basis
465,definition country gdp,explained investopedia gross national product refers quantification economic performance country
466,hedge,hedge generally investment position projected make potential loss might incurred cohort investment
467,rate bank hong kong deal,hibor actually rate bank hong kong deal inter bank market
468,high leveraged transaction,bank loan given company already huge debt high leveraged transaction
469,much voting stock holding company need obtain tax consolidation benefit,explained investopedia essential holding company minimum ofof voting stock obtain tax consolidation benefit like taxfree dividend
470,horizontal integration mean,said horizontal integration refers control ownership
471,definition hostile takeover,hostile takeover take place company taken without choice management especially director
472,importance human resource management every company,human resource management important every company help organizing recruitment process within company
473,definition human resource,human resource collection individual work organization form workforce
474,hyperinflation,hyperinflation economy result decrease value money demand supply formula loses original shape
475,benefit incorporation,many benefit incorporation owner business
476,term international contract,incoterms term used international contract published international chamber commerce
477,inflation,inflation rise price product general consumer turn affect cost living normal consumer
478,definition ipo,however ipo also offered large private company wish trade publicly
479,inside information,inside information material information regarding entity board director management orand employee public aware
480,abbreviation imf,imf abbreviation international monetary fund largest financial economic organization world
481,job analysis,job analysis process used collect information relating responsibility duty skill set conclusion work environment given job
482,joint stock company,joint stock company combination partnership corporation
483,difference bribery kickback,moreover kickback bribery impact welfare system impact overall economy
484,difference accepted theory value labor theory value,labor theory value different accepted theory value state value commodity relation labor required obtaining producing commodity related factor production
485,lessee,person lending property making agreement black white lessee
486,lessee,lessor defined owner property subject matter leased agreement
487,letter credit,case buyer unable make payment time purchase required bank cover full pending amount payment
488,life annuity,life annuity based predetermined amount annuitant wish pay periodically till retirement day
489,limited liability company,according definition limited liability company corporate structure shareholder company limited liability company action
490,limited liability partnership,limited liability partnership basically new kind corporate framework combine flexibility involved partnership benefit limited liability entity compliance price low
491,definition management discussion analysis,management discussion analysis basically business related information mandated security exchange commission must also come withyears financial statement audited
492,marginal utility,marginal utility concept according customer provided sense satisfaction gain received consumer getting good service one unit
493,definition market economy,market economy decision related production investment distribution dependent demand supply free price system free price mechanism used determining price good service
494,end security life,simple word explained end security life
495,microcredit,microcredit scheme introduced benefit small level borrower
496,definition microeconomics,thus general microeconomics pay attention pattern demand supply determines output price different market
497,micro finance,like unemployed low income group
498,mixed economy,economic system exhibit characteristic market economy planned economy
499,definition money laundering,money laundering considered serious crime
500,definition money market,security money market incorporates certificate deposit negotiable u
501,monopoly,monopoly situation wherein single entity owns either nearly market particular kind service product
502,mortgage,mortgage refers lien loan property supposed paid specific time period
503,negotiable instrument,negotiable instrument document provides guarantee payment specific amount money
504,definition noncumulative preferred stock,noncumulative preferred stock refers preferred stock share usually dividend starting every year
505,difference shoring outsourcing,shoringis type outsourcing company outsources function done another country
506,definition oligopoly,oligopoly refers market structure hold held hand firm
507,definition book,example book several different story different author called omnibus
508,overdraft,simple word overdraft allows individual continue withdrawal even zero fund
509,participatory management,participative management decentralized form management
510,pension agreement,basically pension parachute pension agreement state case hostile take raiding firm able use pension asset finance acquisition pension plan asset available provide benefit participant plan
511,performance management,performance management process focus achieving target goal efficient effective manner
512,definition perpetual debenture,defined bond maturity date
513,purpose personnel selection process,personnel selection process used hiring individual pool job applicant required qualification knowledge skill competence fill vacant position organization
514,definition petty corruption,term petty corruption used corruption done small scale corruption done lowlevel
515,pledge mean,word pledge mean promise thing make bound something
516,predatory lending considered legal practice,predatory lending considered legal practice
517,preemptive right mean,preemptive right refer shareholder posse right maintain share ownership organization buying proportional number share percentage share already corporation
518,preferred stock,preference share refer stock proffer specific dividend paid prior payment dividend paid common shareholder
519,phenomenon mark repayment loan time early installment,borrower normally repays loan order save oneself form high interest rate repayment observed case refinancing borrower
520,definition private company,ownership company private reason required meet necessary rule public company
521,difference private collective property,private property even different collective property owned group individual
522,prospectus,prospectus legal document required every company filed security exchange commission provide detail investment offered public sale
523,definition protectionism,country using protectionism feel industry getting damage unfair global competition
524,public corporation,public company also known public corporation company whose share traded publicly company plenty shareholder
525,happens agreement signed two party,return favor provided party paying loan another second party agree upon reimbursement amount later date keeping agreement first foremost priority
526,definition quasi rent,term quasi rent new economist
527,purpose accounting policy,accounting policy seldom done
528,form security sell like stock major exchange,form security sell like stock major exchange directly invested real estate either help mortgage property
529,mortgage investment conduit,remic special purpose vehicle spv issuance mortgagebacked security pool mortgage loan
530,recapitalization,recapitalization term used denote sort legal reorientation company capital structure
531,definition recession,word recession mainly associated big decline economic activity country term industrialization employment activity
532,purpose double taxation,passed shareholder highly personal basis one avoid aspect double taxation certain extent
533,first thing strike mind people matter economy,matter economy first thing strike mind people security risk management
534,best way conduct long distance transaction,conduct long distance transaction system come wellorganized term condition becomes beneficial management get transaction done
535,definition risk management,essentially risk management happens time capitalist fund manager examines effort quantify possibility deprivation investment carry precise action inaction given investment target risk margin
536,saleleaseback arrangement,saleleaseback arrangement owner sell belonging property instantly lease back buyer part transaction
537,self financing,self financing procedure company individual spends money completion ongoing project case unavailability funding source
538,single premium deferred annuity,single premium deferred annuity type annuity contract recognized solitary lumpsum payment owner
539,difference sole proprietorship company,businessmen prefer sole proprietorship would think name run company named sole proprietor
540,spot market,spot market commodity security market good perishable nonperishable sold money delivered immediately within short span time
541,definition sic,standard 4digit code used u government identify industry according function product standard industrial classification
542,main type cost associated starting business,startup cost basically nonrecurring costswhich associated setting business fee accountant registration charge legal fee promotional advertising activity well employee training
543,importance strategic planning organization,simple putting strategic planning analysis determines company going next year going get position know getting specified goal
544,asubordinated debt,word asubordinated debt rank security loan phase loan repayment occurs
545,definition subprime lending,many name term subprime lending
546,surplus theory,concept surplus theory developed written karl marx term invented
547,main type swap,recent time swap grown take account currency swap interest rate swap
548,definition task analysis,task analysis recognition prime element given job understanding skill required make sure job done perfect outcome
549,main goal taylorism,main goal taylorism provide way bettering economy especially field labor production
550,definition technical analysis,technical analyst endeavor estimate intrinsic value security
551,basic important question theory economics,basic important question theory economics price good service priced price good service considered correct price good service calculated
552,time management,time management variety technique skill tool may used managing time specific goal project task needed accomplished within given due date
553,trade mark,trademark registered symbol represents specific product intellectual property manufacturer distributor product specified personnel right manufacture distribute product realize profit
554,transfer pricing,transfer pricing business division treated separate entity price charged one part company another part company order provide certain service known transfer pricing
555,definition trustee,term holding trusteeship property possession
556,underwriting,underwriting explained process investment banker raise investment capital investor behalf government corporation issuing security
557,unique selling proposition,let start basic question unique selling proposition
558,definition vci,venture capital financial capital provided investor high potential high risk startup firm small company long term growth potential
559,point vertical integration play role,come point vertical integration play role provide company edge cutting extra cost show efficiency cutting expense spend transportation reducing duration work well
560,voucher,voucher piece evidence prof certain event transaction carried
561,warrant,warrant refers derivative security provides holder right purchase security issuer particular price within specific period time
562,definition form work,form work could anything like product data service
563,yield,yield refers income return investment
564,definition audit engagement,specific audit engagement referred written letter auditor us notify client heshe would engaging auditing service
565,audit evidence,audit evidence generally refers information collected reviewing financial transaction company addition internal control practice essential factor required certification financial statement
566,audit opinion,audit opinion helpful setting scope audit accountant opinion procedure record used creating statement accountant opinion whether financial statement present accurate reflection organization financial condition
567,audit planning,basically step step methodology audit control review financial process internal environment along engagement preparation
568,divided two category,audit procedure divided two category
569,purpose audit report,audit report recorded annual report examines check compliance company financial statement gaap
570,definition residual risk,also referred residual risk audit risk defined risk auditor discern error intentional miscalculation process reviewing financial statement company individual
571,audit sampling,audit sampling defined process applying auditing procedure underof different item organization account balance way every single unit might equal probability selected
572,purpose audit trail,useful tracking market activity improper
573,purpose auditing standard board,auditing standard board produce statement standard guidance certified public accountant nonpublic company audit
574,many firm spread acrosscountries,spread acrosscountries baker tilly international overfirms
575,one top ten audit company world,bdo among top ten audit company world presently sixth preferred audit company
576,definition big four,big four includes four largest international professional service network accountancy professional service
577,comfort letter,auditing context comfort letter letter document independent auditor included preliminary prospectus state though complete audit done review done auditor sufficient assuring information financial statement preliminary prospectus prepared properly best knowledge
578,compliance audit,auditor conduct review security related policy procedure pertaining risk management user access control throughout compliance audit course
579,purpose caats,computer assisted audit technique tool used auditor
580,purpose computer auditing,computer auditing tool facilitates business regard data processing putting special concern targeted operation
581,definition conflict interest,conflict interest believed occur organization individual caught multiple interest one could probably distort motivation one act
582,deloitte touche tohmatsu limited headquarters,company hold headquarters paramount plaza new york city new york midtown manhattan
583,definition detection risk,detection risk actually risk procedure applied auditor fail detect material misstatement financial statement
584,statement,disclaimer opinion basically statement provided auditor doesnt lay sort opinion regard financial position condition company
585,largest private firm u,besides firm ranked 9th largest private company u forbes magazine
586,definition financial auditing,financial auditing refers accounting process applied business
587,gaas,short generally accepted auditing standard gaas refers set systematic guideline used auditor performing audit company financial statement thus ensuring consistency accuracy verifiability action report produced auditor
588,importance connecting client work,company known provide best audit tax consultative knowhow promotes importance connecting client work
589,definition inherent risk,every company apply procedure give accurate result result basically inherited risk factor procedure applied small sample population rather whole population
590,definition institute internal auditor,institute internal auditor implies guidancesetting organization
591,internal audit,internal audit defined evaluation monitoring analysis activity associated operation company also counting business structure information system employee behavior
592,importance international standard professional practice internal auditing,although difference might affect practice internal auditing every environment conformance iias international standard professional practice internal auditing important congregating responsibility internal auditor well internal audit activity
593,role auditor isa,auditor obligatory knowledge whole text isa counting application explanatory material aware objective apply requirement aptly
594,many people work kpmg,moreover firm employ aboutpeople offer three basic service line tax audit advisory
595,litigation risk analysis,litigation risk analysis provides assessment determine whether chance legal action taken company future
596,materiality concept auditing accounting,materiality concept auditing accounting refers truthfulness material
597,purpose model audit,generally model audit appealed banking organization purpose reassuring lender investor alike calculation assumption contained model accurate result obtained model dependable
598,difference unmodified unmodified opinion,information financial statement materially correct opinion auditor unmodified opinion
599,definition nonsampling risk,nonsampling risk risk despite selected appropriate sample auditor arrive wrong conclusion
600,name firm,pkf globally spread overcountries one widest accounting network providing best financial service world
601,name firm shortened,trading name thus shortened pwc septemberas part key rebranding exercise
