,question,answer
205,absorption costing method,absorption costing method involves use total direct cost overhead cost related manufacturing product cost base
206,accelerated depreciation,accelerated depreciation refers method depreciation used income tax accounting purpose allows higher deduction initial year asset life
207,definition accounting analysis,accounting analysis also referred financial analysis financial statement analysis explained assessment stability viability profitability business subbusiness project
208,accounting estimate,accounting estimate approximation amount debited credited item precise mean measurement available
209,accounting policy,accounting policy specific principle base convention rule practice applied entity preparing presenting financial statement
210,definition accounting principle,accounting principle guideline set accounting body every entity must follow preparing financial statement
211,general accepted accounting principle,gaap short generally accepted accounting principle common set accounting principle procedure standard used company compile financial statement
212,definition creditor,seller supplier called creditor
213,credit sale made cash isnt waged time,credit sale made cash isnt waged time sale business buyer augmentation debtor take room
214,definition accrual accounting,accrual accounting refers method accounting evaluates performance position company recognizing economic activity irrespective occurrence cash transaction
215,difference acquisition cost book value,alternatively referred book value cost stated fixed asset section balance sheet
216,definition activity based costing,activity based costing approach determines cost product based activity performed production
217,adjusting entry,accountancy adjusting entry explained journal entry made generally closing accounting period apportion income expenditure period occurred actually
218,administrative expense,administrative expense refer cost operating business directly attributable production good service
219,definition affiliate,term affiliate refers type intercompany relationship involves one company le majority stock held company
220,difference amortization depreciation,accounting amortization similar depreciation method amount decrease period
221,obverse part report,obverse part report includes exciting combination graphic photo well accompany narrative record activity company previous year
222,purpose interim financial statement,however interim financial statement generally unaudited case clearly labeled unaudited thus avoiding misleading statement user
223,asset based financing,asset based financing specialized technique providing structured working capital term loan tenable account receivable machinery inventory equipment real estate
224,definition authorized share,word term also referred authorized share
225,definition authorized share,usually number share authorized much actually required order provide company opportunity issue stock required
226,definition bad debt reserve,usually bad debt reserve considered option debtor liable pay specific amount debt creditor considered bankrupt
227,antonym goodwill,also called negative goodwill
228,balance sheet,balance sheet snapshot company financial condition specific moment time usually close accounting period
229,bill exchange,bill exchange refers written interest bear interest
230,definition living animal,international accounting standard defines biological asset living animal plant
231,bonus depreciation,bonus depreciation refers additional amount deductible depreciation awarded addition usually available
232,book value,book value defined value asset passed balance sheet
233,definition borrowing cost,borrowing cost defined interest cost incurred enterprise relation borrowing fund
234,cost levied borrowing longterm,also cost levied borrowing longterm like real estate mortgage term loan
235,burden rate,actuality burden rate rate indirect cost allocated direct cost make indirect cost part direct cost incurred
236,preferred mean managing business combination,many case preferred mean managing business combination might acquiring controlling amount stock
237,capital expenditure,general definition capital expenditure given fund utilized company acquiring upgrading physical asset like property equipment industrial building
238,definition capitalized cost,capitalized cost incurred financing building fixed asset
239,capitalization rate,capped rate also called capitalization rate
240,cash accounting,cash accounting explained accounting method involves recording receipt period received expense recorded period actually paid
241,cash advance,definition cash advance loan taken credit card charge interest borrower would charged financing charge day cash borrowed day amount repaid full
242,definition cash equivalent,cash equivalent shortterm highly liquid investment readily convertible known amount cash subject insignificant risk change value
243,iasdefine financing activity,ias7 defines financing activity activity result change size composition contributed equity borrowing entity
244,ias7 define investment activity,ias7 defines investing activity activity acquisition disposal longterm asset investment included cash equivalent
245,ias7 define operating activity,ias7 defines operating activity principal revenueproducing activity entity activity investing financing activity
246,operating expense clearing account,example operating expense clearing account maintained keep track entry operating expense close real operating expense account
247,commodity,definition commodity physical substance like grain metal interchangeable another product type bought sold investor sale purchase
248,definition common share,common share aptly defined security lieu equity ownership corporation
249,difference traditional common size financial statement,traditional financial statement used reporting purpose report monetary position company common size financial statement used decisionmaking purpose
250,type income statement used analysis purpose,commonsize income statement type income statement item reported reference revenue company
251,completed contract method accounting,method total contract revenue related cost incurred performance recognizable period contract actually completed
252,definition comprehensive income,according ias1 presentation financial statement comprehensive income change equity period resulting transaction event change resulting transaction owner capacity owner
253,definition conglomerate,however conglomerate diversification business company normal practice usually company depict multiindustry corporate structure
254,meaning consolidated financial statement,putting another way consolidated financial statement addressed combined financial statement parent company subsidiary
255,construction contract,construction contract explained warranty ensures executed job get specific amount compensation way compensation distributed
256,contingent asset,contingent asset possible asset arises past event whose existence confirmed occurrence nonoccurrence one uncertain future event wholly within control entity
257,continuing operation,continuing operation refers business term used define division business company considered normal addition expected operate near future
258,common convertible security,common convertible security includes convertible preferred stock convertible bond transformed common stock equity
259,cost method,cost method method accounting investment whereby investment recognized cost
260,cost good sold,also commonly known cost good sold
261,cost recovery method,cost recovery method basically method recognizing revenue per gross profit recognized till time entire merchandise cost successfully recovered
262,current asset,current asset asset expected used withinmonths
263,liability entity,liability noncurrent liability
264,term equally important finance taxation management accounting,term equally important finance taxation management accounting
265,debt management,debt management refers unofficial agreement unsecured creditor repayment debt specific time period generally extending amount time debt paid back
266,definition reducing balance depreciation method,method depreciation charged asset early year asset life higher gradually decrease year pas
267,deferred tax liability,deferred tax liability amount income tax payable future period respect taxable temporary difference
268,restriction regard employee withdraw fund without penal,besides restriction regard employee withdraw fund without penalized also exist plan
269,defined contribution plan,defined contribution plan basically plan retirement certain specified percentage amount money kept aside every year organization employee benefit
270,mean defined contribution plan,international accounting standard defines defined contribution plan postemployment benefit plan entity pay fixed contribution separate entity legal constructive obligation pay contribution fund hold sufficient asset pay employee benefit relating employee service current prior period
271,direct allocation method,method cost manufacturing service department allocated directly production department company product
272,definition direct cost,word production process product cost labor material expense related production call direct cost
273,definition direct labor cost,case service industry direct labor cost referred labor cost needed providing particular service
274,definition term discontinued operation,discontinued operation refer operation business abandoned sold else wise disposed
275,difference person debt income ratio gross income,besides disposable income amount utilized calculating person debt income ratio
276,definition disposal value,minimum value machine sold without loss called book disposal value
277,distribution cost,distribution cost usually defined cost incurred deliver product production unit end user
278,doubleentry accounting,doubleentry accounting system used record transaction daybook accounting purpose
279,depreciation rate straight line method,depreciation method charged complete purchase price asset rather net salvage value price straight line method
280,percentage company distributable profit allocated outstanding equity share,earnings per share portion company distributable profit allocated outstanding equity share
281,effective interest method,effective interest method method calculating amortized cost financial asset financial liability allocating interest revenue interest expense relevant period
282,example employee benefit,employee benefit explained different nonwage compensation offered employee normal salary wage
283,definition equity,equity equal total asset minus liability
284,issuer return dividend,however necessary issued equity must return dividend based profit term business
285,exchange difference,international accounting standard defines exchange difference difference resulting translating given number unit one currency another currency different exchange rate
286,purpose external reporting,external reporting requires entity provide well documented report circulated amongst public stockholder
287,reason,income statement company event arise extraordinary nonrecurring necessary report
288,definition fair value,international standard accounting define fair value amount asset could exchanged liability settled knowledgeable willing party arm length transaction
289,definition fifo,fifo acronym first first concept way organizing manipulation data proportionate time prioritization
290,definition finance cost,international accounting standarddefines finance cost interest cost entity incurs connection borrowing fund
291,difference financial managerial accounting,financial accounting refers reporting financial position performance firm way financial statement issued external user intervallic basis
292,acronym fasb,fasb standard commonly known gaap manage preparation corporate financial report identified authoritative security exchange commission
293,financial instrument,financial instrument tradable asset kind either cash evidence ownership entity prescribed right receive deliver money financial instrument
294,financial lease,give proper definition expressed agreement wherein lessor receives lease payment covering ownership cost
295,financial report,usually includes summary accounting data year including background note form related info
296,financial statement,financial statement well defined formal record business individual entity financial activity
297,easily understandable,transparency financial statement mean statement user friendly clear everything properly disclosed easily understandable
298,inventory ready sold,finished good part manufacturing process work inventory completed turned finished good ready sold
299,fixed asset,fixed asset longterm tangible piece property firm owns us production income expected consumed converted cash withinmonths
300,fixed asset,fixed asset defined longterm tangible property piece owned firm used purpose incomegeneration
301,fixed capital,fixed capital clearly referred physical capital real capital consumed invested production real product
302,definition foreign currency translation,per u gaap regulation item balance sheet converted exchange rate existing balance sheet date
303,meaning forensic accounting,meaning forensic suitable use court law forensic accountant usually work potential standard outcome
304,forward contract,forward contract defined cash market transaction involves delivery commodity deferred contract created
305,forward rate,forward rate defined rate applicable situation financial transaction
306,making financial statement untransparent,another reason behind making financial statement untransparent give fruitful view firm investor aim attracting
307,difference operating cash flow capital expenditure,may also known operating cash flow minus capital expenditure
308,general accepted accounting principle,generally accepted accounting principle refers widely accepted set rule standard convention procedure reporting financial info
309,meaning going concern,company going concern indicates company gone bankrupt
310,goodwill,generally goodwill represents value intangible asset like good customer relation strong brand name good employee relation kind patent proprietary technology
311,government accounting standard board,government accounting standard board organization aim improving creating accounting reporting related standard gaap
312,definition historical cost,framework international accounting standard board defines historical cost measurement basis according asset recorded amount cash cash equivalent paid fair value consideration given acquire time acquisition
313,ifrs financial statement form,ifrs financial statement form include following statement financial position statement comprehensive income
314,possible write impairment asset,however possible write impairment asset
315,profit loss statement,income statement measure company financial performance specific accounting period
316,definition incremental cost,also referred marginal cost
317,role independence standard board financial reporting procedure public entity,numerous security related law enacted congress managed sec state credibility integrity finance related reporting procedure public entity depends largely auditor operate independently auditing customer
318,intangible asset,intangible asset identifiable nonmonetary asset without physical substance
319,intercompany elimination,intercompany elimination refers process removal transaction company included group preparation consolidated account
320,purpose interim financial statement,interim financial statement applied order convey performance financial company beginning fiscal year end fiscal year
321,role iasb,moreover iasb also responsible maintaining ifrs
322,ifrs,ifrs represent set internationally accepted accounting principle used company prepare financial statement
323,ias2 inventory revised,standard applied annually january2005
324,definition inventory accounting,inventory accounting refers part accounting dealing assessing accounting change inventoried asset
325,line credit,inventory financing refers line credit shortterm loan made company purchasing product sale
326,difference face value share issued shareholder,face value share issued shareholder
327,justintime inventory strategy,justintime inventory strategy referred production strategy employed increase level efficiency reduce waste receiving good form required production process thus reducing inventory cost
328,lease,give legal definition lease rightly stated written agreement wherein owner property allows tenant use property specific time period certain amount rent
329,libor,short london interbank offer rate libor defined interest rate charged one bank another loan
330,last first method,acronym last first lifo method presumes asset acquired produced last sold used disposed first
331,liquidation value,liquidation value defined estimated amount money could received quickly sale asset company
332,longterm liability,longterm liability refer category debt presented balance sheet company required repaid upcoming twelve month instead required paid back within year
333,mark market,mark market used measuring fair value account could alter time like liability asset
334,definition market value,apt definition market value current quoted price share common stock bond bought sold investor specific time
335,current asset,good arent sold accounting cycle price good registered form current asset continue feature balance sheet till time sold
336,minimum lease payment,minimum lease payment payment lease term lessee required make excluding contingent rent cost service tax paid reimbursed lessor together
337,noncontrolling interest business,also referred noncontrolling interest business minority interest accounting concept deal part subsidiary corporation stock owned parent corporation
338,alternative term equity,term net asset alternative term equity
339,net book value asset,net book value defined simple word net value asset
340,net realizable value,generally field accounting net realizable value technique used calculate worth asset inventory
341,net sale number company,net sale refer amount sale engendered business deducting return tax like vat allowance damaged missing good discount allowed
342,net worth,net worth difference company total asset liability
343,definition nominal value,nominal value refers stated value issued security remains permanent compared market value fluctuating nature factor like inflation
344,definition noncontrolling interest,international accounting standard defines noncontrolling interest equity subsidiary attributable directly indirectly parent
345,noncurrent asset,noncurrent asset asset include amount expected recovered thanmonths reporting period
346,noncurrent liability,noncurrent liability liability due paid withinmonths normal course business
347,difference normal costing actual overhead rate,since normal costing make use standard overhead rate instead actual overhead rate method used determining product cost sudden increase cost
348,balance sheet,balance sheet refers asset debt financing activity presented balance sheet entity
349,expense incurred daytoday operation business,expense revenue nature since incurred daytoday operation business incur noncurrent asset
350,definition operating income,operating income income reported income statement company taking account interest taxation
351,operating lease,operating lease basically lease contract allows use asset right similar asset ownership conveyed
352,variable overhead cost,variable overhead cost constant calculated per unit become variable totaled volume output
353,seminal contributor field accounting,seminal contributor field accounting although accounting labeled discipline time
354,par value bond,par value defined face value stated value bond
355,percentageofcompletion method accounting,percentageofcompletion method accounting based revenue recognition principle provides framework recognize revenue expense account company
356,perpetual inventory system,help business updating inventory altering level order placed sale made
357,definition perpetual inventory system,perpetual inventory system defined keeping record stock
358,definition balance sheet,preparing balance sheet inherent part accounting procedure
359,definition postemployment benefit,international accounting standard defines postemployment benefit employee benefit payable completion employment
360,postretirement pension,one form retirement pension paid employee retirement year
361,pro forma invoice,pro forma invoice used various business almost industry
362,process costing method,process costing trace accumulates direct cost allocates indirect cost incurred manufacturing process
363,definition cost production,cost production refers total sum money needed production particular quantity output
364,profit center,profit center division within entity treated separate corporation
365,meaning sentence,meant profit distribution
366,definition provision,international accounting standard defines provision liability uncertain timing amount
367,purpose public oversight board,public oversight board created yearby aicpa usa
368,common accounting method used accounting standard,acquisition accounting also popularly known purchasing method accounting used accounting standard
369,entity preparing account acquisition merger subsidiary usually purchased,accounting entity preparing account acquisition merger subsidiary usually purchased purchase cost rather historical cost
370,qq,qualifying asset asset necessarily take substantial period time get ready intended use sale
371,definition raw material,raw material explained substance material used manufacturing primary production good
372,difference daily profit realized profit,daily profit also known paper profit common parlance amount company business gain daily subtracting amount invested business
373,meaning balancing two account,term also synonymous term bank reconciliation statement refers balancing two account sake checking much amount actual money spent
374,much company buy bond,redemption value considered value company purchase security much time get matured
375,difference salvage value residual value,accountancy residual value also called salvage value fully depreciated worth asset
376,procedure accounting imperative estimate value merchandise store,considering financial aspect particular company store necessary take consideration procedure accounting imperative estimate value merchandise store
377,definition retained earnings,retained earnings sum profit retained company since inception
378,salvage value,salvage value projected resale value asset close useful life
379,purpose sec,sec hold power licensing regulating stock exchange company whose security traded dealer broker carried trading
380,share premium,share premium amount received company face value share
381,difference total asset total liability company,shareholder equity amount show company financed help common share preferred share
382,definition statement cash flow,statement cash flow explained one financial report required disclosed according ifrs u gaap
383,purpose statement change equity,statement change equity explained statement change equity corporation feature created partnership sole proprietorship corporation
384,definition comprehensive income,comprehensive income change equity business enterprise period transaction event circumstance nonowner source
385,new name balance sheet used ifrs,statement financial position new name balance sheet used ifrs
386,shareholder,shareholder stockholder company organization individual another organization legally owns partial full stock public private corporation
387,popular simple method depreciation,straightline method depreciation popular simple method depreciation
388,subsidiary,subsidiary entity entity controlled another entity
389,temporal method,temporal method defined method translating foreign currency use exchange rate based time acquisition asset liability
390,term refers cost carrying transaction,transaction cost term refers cost incurred process carrying transaction
391,difference treasury share treasury share,treasury share share bought back issuing company reducing number share outstanding open market
392,real cost issuing bond,also referred also refer real cost issuing bond
393,difference unit production depreciation unit activity method,unit production depreciation name suggests depreciation asset based number unit produce rather number year useful life left
394,definition unrealized loss,unrealized loss exists value stock decrease purchased investor heshe yet sold
395,happens borrower declared bankrupt,usually occurs case borrower declared bankrupt fails meet term repayment loan debt
396,meaning term gaap,term confined u therefore generally abbreviated u gaap
397,main point comparison u gaap ifrs,main point comparison u gaap ifrs include
398,part inventory currently worked yet production process,work progress part inventory currently worked yet production process
399,accelerated buy back,accelerated buy back also called accelerated share repurchase gimmick used company desire way generate cash shareholder without going formality traditional buyback program without throwing balance sheet kilter
400,term used describe subject matter sale,example company traded sold subject matter sale mean part sale
401,definition acquirer,acquirer either reject purchase accept placing money seller account
402,definition insolvency act,bankruptcy act also called insolvency act defined decree according lawful practice bankruptcy law curb menace especially canada
403,main contribution adam smith time scottish enlightenment,main figure played positive productive role time scottish enlightenment
